{
  "$schema": "https://json-schema.org/draft/2020-12/schema",
  "title": "MD-OS Workflow Definition",
  "type": "object",
  "required": [
    "id",
    "name",
    "trigger",
    "nodes"
  ],
  "properties": {
    "id": {
      "type": "string"
    },
    "name": {
      "type": "string"
    },
    "trigger": {
      "type": "object",
      "required": [
        "type"
      ],
      "properties": {
        "type": {
          "type": "string",
          "enum": [
            "event",
            "cron",
            "manual"
          ]
        },
        "source": {
          "type": "string"
        },
        "event": {
          "type": "string"
        },
        "schedule": {
          "type": "string"
        },
        "action": {
          "type": "string"
        }
      }
    },
    "nodes": {
      "type": "array",
      "minItems": 1,
      "items": {
        "type": "object",
        "required": [
          "id"
        ],
        "properties": {
          "id": {
            "type": "string"
          },
          "agent": {
            "type": "string"
          },
          "action": {
            "type": "string"
          },
          "condition": {
            "type": "string"
          },
          "true": {
            "type": "string"
          },
          "false": {
            "type": "string"
          }
        }
      }
    }
  }
}